{
  "pair": "SOL/USDC",
  "source": "orca",
  "observedAtUnixMs": 1700000000000,
  "pool": {
    "poolId": "Czfq3xZZDmsdGdUyrNLtRhGc47cXcZtLG4crryfu44zE",
    "pair": "SOL/USDC",
    "source": "orca",
    "observedAtUnixMs": 1700000000000,
    "tokenPairLabel": "SOL/USDC",
    "currentPrice": 140.5,
    "currentPriceLabel": "$140.50",
    "sqrtPrice": "123456789012345678",
    "tickCurrentIndex": -12345,
    "tickSpacing": 64,
    "feeRate": 3000,
    "feeRateLabel": "0.3%",
    "poolLiquidity": "98765432101234",
    "priceSource": "orca_whirlpool_sqrt_price"
  },
  "srLevels": {
    "briefId": "brief-sol-usdc-2026-07-28",
    "sourceRecordedAtIso": "2026-07-28T12:00:00.000Z",
    "summary": "Consolidation within $130 - $160 range",
    "capturedAtUnixMs": 1700000000000,
    "supports": [
      {
        "price": 130.0,
        "rank": "1",
        "timeframe": "1D",
        "notes": "Strong psychological support"
      }
    ],
    "resistances": [
      {
        "price": 160.0,
        "rank": "1",
        "timeframe": "1D",
        "notes": "Key resistance level"
      }
    ]
  },
  "positions": [
    {
      "walletId": "Wallet1111111111111111111111111111111111",
      "positionId": "Posn111111111111111111111111111111111111",
      "poolId": "Czfq3xZZDmsdGdUyrNLtRhGc47cXcZtLG4crryfu44zE",
      "pair": "SOL/USDC",
      "source": "orca",
      "observedAtUnixMs": 1700000000000,
      "rangeState": "in-range",
      "lowerTick": -15000,
      "upperTick": -10000,
      "currentTick": -12345,
      "lowerPriceLabel": "$110.00",
      "upperPriceLabel": "$180.00",
      "currentPrice": 140.5,
      "currentPriceLabel": "$140.50",
      "rangeDistance": {
        "belowLowerTickPercent": 15.2,
        "aboveUpperTickPercent": 22.4,
        "belowLowerPricePercent": 21.7,
        "aboveUpperPricePercent": 28.1
      },
      "feeRateLabel": "0.3%",
      "unclaimedFees": {
        "feeOwedA": {
          "raw": "150000000",
          "decimals": 9,
          "symbol": "SOL"
        },
        "feeOwedB": {
          "raw": "25000000",
          "decimals": 6,
          "symbol": "USDC"
        }
      },
      "unclaimedRewards": [
        {
          "mint": "Orca111111111111111111111111111111111111111",
          "raw": "500000000",
          "decimals": 6,
          "symbol": "ORCA"
        }
      ],
      "unclaimedFeesUsd": 46.25,
      "unclaimedRewardsUsd": 2.5,
      "principalTokenAmounts": {
        "tokenA": {
          "raw": "10000000000",
          "decimals": 9,
          "symbol": "SOL",
          "mint": "So11111111111111111111111111111111111111112"
        },
        "tokenB": {
          "raw": "1400000000",
          "decimals": 6,
          "symbol": "USDC",
          "mint": "EPjFWdd5AufqSSqeM2qN1xzybapC8G4wEGGkZwyTDt1v"
        },
        "observedAtUnixMs": 1700000000000,
        "source": "orca_full_liquidity_quote",
        "basis": "principal-only"
      },
      "usdPriceQuotes": [
        {
          "mint": "So11111111111111111111111111111111111111112",
          "symbol": "SOL",
          "usdPerToken": 140.5,
          "quotedAtUnixMs": 1700000000000,
          "source": "jupiter"
        },
        {
          "mint": "EPjFWdd5AufqSSqeM2qN1xzybapC8G4wEGGkZwyTDt1v",
          "symbol": "USDC",
          "usdPerToken": 1.0,
          "quotedAtUnixMs": 1700000000000,
          "source": "jupiter"
        }
      ],
      "positionLiquidity": "500000000",
      "poolLiquidity": "98765432101234",
      "hasActionableTrigger": false
    }
  ],
  "alerts": [],
  "dataQuality": {
    "partial": false,
    "warnings": []
  }
}
